Question Number,Question,Correct Answer,Incorrect Answers
7,"Which of these bands was a featuring artist in Compton rapper Kendrick Lamar's 2017 album, ""DAMN.""?",U2,Radiohead;Coldplay;Bon Jovi
8,What is rapper Drake's real name?,Aubrey Graham,Shaun Carter;Dwayne Carter;Andre Young
9,When was Gangnam Style uploaded to YouTube?,2012,2013;2014;2011
10,"Which group performs the song ""Crash into Me""?",Dave Matthews Band,Phish;The Grateful Dead;Destiny&#039;s Child
Question Number,Question,Correct Answer,Incorrect Answers
1,What song on ScHoolboy Q's album Black Face LP featured Kanye West?,THat Part,Neva CHange;Big Body;Blank Face
2,Who is the frontman of Muse?,Matt Bellamy,Dominic Howard;Thom Yorke;Jonny Greenwood
3,"""Twenty One Pilots"" made the song ""The Motion"" featuring Sampha.",False,True
4,Who was the lead singer and frontman of rock band R.E.M?,Michael Stipe,Chris Martin;Thom Yorke;George Michael
5,"Who was not in the band ""The Smiths""?",Martin Chambers,Morrissey;Andy Rourke;Mike Joyce
6,"Which novelty band was best known for their UK chart hits ""Combine Harvester"" and ""I Am a Cider Drinker"" in 1976?",The Wurzels,Goldie Lookin Chain;Bonzo Dog Doo-Dah Band;The Firm
7,Which Death Grips album is the only one to feature a band member?,No Love Deep Web,Bottomless Pit;The Money Store;The Powers That B
8,What is the relationship between the band members of American rock band King of Leon?,Brothers &amp; cousins,Childhood friends;Former classmates;Fraternity house members
9,"""Some people call me the space cowboy"" is the first line from what song?",The Joker,Fandango;Take The Money and Run;Fly Like an Eagle
10,Which of these Johns was murdered by gunshots outside the Dakota in New York in 1980?,John Lennon,Johnny Thunders;John Denver;John Cascella
Question Number,Question,Correct Answer,Incorrect Answers
1,Which one of these artists appears in the album Deltron 3030?,Dan the Automater,Lamarr Kendrick;Danger Mouse;CeeLo Green
2,How many strings are there on a cello?,4,5;6;8
3,Which Twitch streamer is the vocalist for Red Vox?,Vinesauce,The8BitDrummer;LIRIK;Sodapoppin
4,"Which Aerosmith album featured ""Walk This Way""?",Toys in the Attic,Rocks;Get Your Wings;Draw the Line
5,"When did The Beatles release the LP ""Please Please Me""?",1963,1970;1960;1969
6,"""Make You Feel My Love"" was originally written and performed by which singer-songwriter?",Bob Dylan,Elvis;Adele;Billy Joel
7,In what year was Tchaikovsky's 1812 Overture composed?,1880,1812;1790;1840
8,"The 2016 song ""Starboy"" by Canadian singer The Weeknd features which prominent electronic artist?",Daft Punk,deadmau5;Disclosure;DJ Shadow
9,What album did The Lumineers release in 2016?,Cleopatra,Winter;The Lumineers;Tracks From The Attic
10,"The song ""Twin Size Mattress"" was written by which band?",The Front Bottoms,Twenty One Pilots;The Wonder Years;The Smith Street Band
Question Number,Question,Correct Answer,Incorrect Answers
1,Which of these Disney shows is classified as an anime?,Stitch!,Cory in the House;The Emperor&#039;s New School;Hannah Montana
2,"AMC's ""The Walking Dead"", Rick, Carl, Daryl, Morgan, Carol and Maggie were introduced to us in Season 1.",False,True
3,"In the episode of SpongeBob SquarePants, ""Survival of the Idiots"", Spongebob called Patrick which nickname?",Pinhead,Starfish;Larry;Dirty Dan
4,"Which of the following actors portrayed the Ninth Doctor in the British television show ""Doctor Who""?",Christopher Eccleston,David Tennant;Matt Smith;Tom Baker
5,"Which WWF wrestler had the nickname ""The Ayatollah of Rock 'N' Rolla""?",Chris Jericho,Marty Jannetty;Scott Hall;Shawn Michaels
6,Which British writer wrote for both Doctor Who and Sherlock?,Steven Moffatt,Phil Ford;Russell T Davies;Toby Whithouse
7,"In ""It's Always Sunny in Philadelphia"" what was the name of Frank's wrestling persona?",The Trash Man,Bird of War;Day Man;The Maniac
8,"Which of the following was not an actor/actress on the American television show ""Saturday Night Live"" in Season 42?",Tina Fey,Mikey Day;Kate McKinnon;Sasheer Zamata
9,Who sang the theme song for the TV show 'Rawhide'?,Frankie Laine,Guy Mitchell; Tennessee Ernie Ford;Slim Whitman
10,"What is the title of The Allman Brothers Band instrumental used as the theme to the BBC motoring show, 'Top Gear'?",Jessica,Angela;Erica;Sandra
Question Number,Question,Correct Answer,Incorrect Answers
1,What NBC sitcom once saw two of its characters try to pitch NBC on a sitcom about nothing?,Seinfeld,Frasier;Becker;Friends
2,"The theme for the popular science fiction series ""Doctor Who"" was composed by who?",Ron Grainer,Murray Gold;Delia Derbyshire;Peter Howell
3,"What is the name of Chris's brother in ""Everybody Hates Chris""?",Drew,Jerome;Greg;Joe
4,"What was the UK ""Who Wants to be a Millionaire?"" cheating scandal known as?",Major Fraud,Ingram Cheater;Coughing Major;Millionaire Crime
5,"On the show ""Rick and Morty"", in episode ""Total Rickall"", who was a parasite?",Pencilvester,Beth Smith;Summer Smith;Mr. Poopy Butthole
6,"Who was the star of the TV series ""24""?",Kiefer Sutherland,Kevin Bacon;Hugh Laurie;Rob Lowe
7,What is the name of the main antagonists in Battlestar Galactica?,The Cylons,The Collective;The Federation;The Rebels
8,What is the Klingon's afterlife called?,Sto-vo-kor,Valhalla;Karon&#039;gahk;New Jersey
9,"Who played the Waitress in the Spam sketch of ""Monty Python's Flying Circus""?",Terry Jones,Eric Idle;Graham Chapman;John Cleese
10,Which of these Disney shows is classified as an anime?,Stitch!,Cory in the House;The Emperor&#039;s New School;Hannah Montana
Question Number,Question,Correct Answer,Incorrect Answers
1,"Which punk rock band released hit songs such as ""Californication"", ""Can't Stop"" and ""Under the Bridge""?",Red Hot Chilli Peppers,Green Day;Linkin Park;Foo Fighters
2,"Who was the guitarist in the band ""The Doors""?",Robby Krieger,Eric Clapton;John Densmore;Jimi Hendrix
3,Which one of these Rammstein songs has two official music videos?,Du Riechst So Gut,Du Hast;Benzin;Mein Teil
4,What's the most common time signature for rock songs?,4/4,1/2;8/12;2/4
5,Which Beatle led the way across the zebra crossing on the Abbey Road album cover?,John,Paul;George;Ringo
6,What country did Shirley Bassey originate from?,Wales,America;England;Canada
7,"Moby, an American DJ, singer, and musician, achieved worldwide success for the 1999 release of which of the following albums?",Play,Everything Is Wrong;Moby;18
8,What was the title of ABBA`s first UK hit single?,Waterloo,Mamma Mia;Fernando;Dancing Queen
9,"The song ""Stronger Than You"" is a single by Estelle, who played Garnet in Steven Universe.",True,False
10,"Which artist collaborated with American DJ Dillon Francis to release the song 2016 ""Need You""?",NGHTMRE,LOUDPVCK;KRNE;DVBBS
